<?xml version="1.0" encoding="UTF-8"?>
<CartMappingsConfig xmlns="http://gruppoinit.it/sigepro/schemas/cartmapping" xmlns:xsi="http://www.w3.org/2001/XMLSchema-instance"
	xsi:schemaLocation="http://gruppoinit.it/sigepro/schemas/cartmapping cart-sigepro-mapping.xsd ">
	<!-- QUADRO 01 -->
	<cart-mapping>
		<id-semantico>COMUNE_SUAP</id-semantico>
		<value>
			<vbg-value>
				<campo-statico>comune.comune</campo-statico>
			</vbg-value>
		</value>
	</cart-mapping>

	<cart-mapping>
		<id-semantico>PRATICA_TIPOLOGIA</id-semantico>
		<value>
			<vbg-value>
				<valore-fisso>comunicazione</valore-fisso>
			</vbg-value>
		</value>
	</cart-mapping>

	<cart-mapping>
		<id-semantico>PRATICA_AZIONE</id-semantico>
		<value>
			<vbg-value if-property="alberoproc.stpEndoTipo2s.stpTipologieEndo2.descrizione">
				<campo-statico>alberoproc.stpEndoTipo2s.stpTipologieEndo2.descrizione</campo-statico>
			</vbg-value>
			<vbg-value>
				<valore-fisso>variazione</valore-fisso>
			</vbg-value>
		</value>
		<value-mappings>
			<value-mapping>
				<vbg-value-match>Avvio</vbg-value-match>
				<cart-value>avvio</cart-value>
			</value-mapping>
			<value-mapping>
				<vbg-value-match>Variazione</vbg-value-match>
				<cart-value>variazione</cart-value>
			</value-mapping>
			<value-mapping>
				<vbg-value-match>Subingresso</vbg-value-match>
				<cart-value>subentro</cart-value>
			</value-mapping>
			<value-mapping>
				<vbg-value-match>Chiusura</vbg-value-match>
				<cart-value>cessazione</cart-value>
			</value-mapping>
			<value-mapping>
				<vbg-value-match>.*</vbg-value-match>
				<cart-value>variazione</cart-value>
			</value-mapping>
		</value-mappings>
	</cart-mapping>

	<cart-mapping>
		<id-semantico>CODICE_ATTIVITA_REGIONALE</id-semantico>
		<value>
			<vbg-value if-property="alberoproc.stpEndoTipo2s.codiceEndoRegionale">
				<campo-statico>alberoproc.stpEndoTipo2s.codiceEndoRegionale</campo-statico>
			</vbg-value>
			<vbg-value>
				<valore-fisso>NON DEFINITA</valore-fisso>
			</vbg-value>
		</value>
	</cart-mapping>

	<cart-mapping>
		<id-semantico>DESCR_ATTIVITA_REGIONALE</id-semantico>
		<value>
			<vbg-value if-property="alberoproc.vwAlberoproc.scDescrizionepadre">
				<campo-statico>alberoproc.vwAlberoproc.scDescrizionepadre</campo-statico>
			</vbg-value>
		</value>
	</cart-mapping>

	<cart-mapping>
		<id-semantico>COD_ATTIVITA_PRIMARIA_ATECO</id-semantico>
		<value>
			<vbg-value if-property="alberoproc.stpEndoTipo2s.codiceEndoRegionale">
				<campo-statico>alberoproc.stpEndoTipo2s.codiceEndoRegionale</campo-statico>
			</vbg-value>
		</value>
	</cart-mapping>

	<cart-mapping>
		<id-semantico>DESCR_ATTIVITA_PRIMARIA_ATECO</id-semantico>
		<value>
			<vbg-value if-property="alberoproc.vwAlberoproc.scDescrizionepadre">
				<campo-statico>alberoproc.vwAlberoproc.scDescrizionepadre</campo-statico>
			</vbg-value>
		</value>
	</cart-mapping>
	

	<!-- Quadro A1 -->
	<cart-mapping>
		<id-semantico>RICHIEDENTE.NOME</id-semantico>
		<value>
			<vbg-value>
				<campo-statico>richiedente.nome</campo-statico>
			</vbg-value>
		</value>
	</cart-mapping>

	<cart-mapping>
		<id-semantico>RICHIEDENTE.COGNOME</id-semantico>
		<value>
			<vbg-value>
				<campo-statico>richiedente.nominativo</campo-statico>
			</vbg-value>
		</value>
	</cart-mapping>

	<cart-mapping>
		<id-semantico>RICHIEDENTE.CF</id-semantico>
		<value>
			<vbg-value>
				<campo-statico>richiedente.codicefiscale</campo-statico>
			</vbg-value>
		</value>
	</cart-mapping>

	<cart-mapping>
		<id-semantico>RICHIEDENTE.NATO_A</id-semantico>
		<value>
			<vbg-value>
				<campo-statico>richiedente.comuneNascita.comune</campo-statico>
			</vbg-value>
		</value>
	</cart-mapping>

	<cart-mapping>
		<id-semantico>RICHIEDENTE.DATA_NASCITA</id-semantico>
		<value>
			<vbg-value>
				<campo-statico>richiedente.datanascita</campo-statico>
			</vbg-value>
		</value>
	</cart-mapping>

	<cart-mapping>
		<id-semantico>RICHIEDENTE.CITTADINANZA</id-semantico>
		<value>
			<vbg-value if-property="richiedente.cittadinanza.cittadinanza" if-operator="EQUALS" if-value="ITALIA">
				<valore-fisso>ITALIANA</valore-fisso>
			</vbg-value>
			<vbg-value if-property="richiedente.cittadinanza.flgPaeseComunitario" if-operator="EQUALS" if-value="true">
				<valore-fisso>COMUNITARIA</valore-fisso>
			</vbg-value>
			<vbg-value if-property="richiedente.cittadinanza.flgPaeseComunitario" if-operator="EQUALS" if-value="false">
				<valore-fisso>NON COMUNITARIA</valore-fisso>
			</vbg-value>
			<vbg-value>
				<valore-fisso>ITALIANA</valore-fisso>
			</vbg-value>
		</value>
	</cart-mapping>

	<cart-mapping>
		<id-semantico>RICHIEDENTE.CITTADINANZA.COMUNITARIA</id-semantico>
		<value>
			<vbg-value if-property="richiedente.cittadinanza.flgPaeseComunitario" if-operator="EQUALS" if-value="true">
				<campo-statico>richiedente.cittadinanza.cittadinanza</campo-statico>
			</vbg-value>
		</value>
	</cart-mapping>

	<cart-mapping>
		<id-semantico>RICHIEDENTE.CITTADINANZA.NONCOMUNITARIA</id-semantico>
		<value>
			<vbg-value if-property="richiedente.cittadinanza.flgPaeseComunitario" if-operator="EQUALS" if-value="false">
				<campo-statico>richiedente.cittadinanza.cittadinanza</campo-statico>
			</vbg-value>
		</value>
	</cart-mapping>

	<cart-mapping>
		<id-semantico>RICHIEDENTE.RESIDENZA.STATO</id-semantico>
		<value>
			<vbg-value if-property="richiedente.comuneResidenza.siglaprovincia" if-operator="EQUALS" if-value="EE">
				<valore-fisso>RESIDENTE ALL'ESTERO</valore-fisso>
			</vbg-value>
			<vbg-value if-property="richiedente.comuneResidenza.siglaprovincia" if-operator="NOT_EQUALS" if-value="EE">
				<valore-fisso>RESIDENTE IN ITALIA</valore-fisso>
			</vbg-value>
		</value>
	</cart-mapping>

	<cart-mapping>
		<id-semantico>RICHIEDENTE.RESIDENZA.ITALIA.COMUNE</id-semantico>
		<value>
			<vbg-value if-property="richiedente.comuneResidenza.siglaprovincia" if-operator="NOT_EQUALS" if-value="EE">
				<campo-statico>richiedente.comuneResidenza.comune</campo-statico>
			</vbg-value>
		</value>
	</cart-mapping>

	<cart-mapping>
		<id-semantico>RICHIEDENTE.RESIDENZA.ITALIA.PROVINCIA</id-semantico>
		<value>
			<vbg-value if-property="richiedente.comuneResidenza.siglaprovincia" if-operator="NOT_EQUALS" if-value="EE">
				<campo-statico>richiedente.comuneResidenza.siglaprovincia</campo-statico>
			</vbg-value>
		</value>
	</cart-mapping>

	<cart-mapping>
		<id-semantico>RICHIEDENTE.RESIDENZA.ITALIA.VIA</id-semantico>
		<value>
			<vbg-value if-property="richiedente.comuneResidenza.siglaprovincia" if-operator="NOT_EQUALS" if-value="EE">
				<campo-statico>richiedente.indirizzo</campo-statico>
			</vbg-value>
		</value>
	</cart-mapping>

	<cart-mapping>
		<id-semantico>RICHIEDENTE.RESIDENZA.ITALIA.CAP</id-semantico>
		<value>
			<vbg-value if-property="richiedente.comuneResidenza.siglaprovincia" if-operator="NOT_EQUALS" if-value="EE">
				<campo-statico>richiedente.comuneResidenza.cap</campo-statico>
			</vbg-value>
		</value>
		<value-processing>
			<value-replace>
				<replace-match>\D</replace-match>
				<replace-with></replace-with>
			</value-replace>
		</value-processing>
	</cart-mapping>

	<cart-mapping>
		<id-semantico>RICHIEDENTE.RESIDENZA.ITALIA.TELEFONO</id-semantico>
		<value>
			<vbg-value if-property="richiedente.comuneResidenza.siglaprovincia" if-operator="NOT_EQUALS" if-value="EE">
				<campo-statico>richiedente.telefono</campo-statico>
			</vbg-value>
			<vbg-value>
				<valore-fisso>00000000000</valore-fisso>
			</vbg-value>
		</value>
	</cart-mapping>

	<cart-mapping>
		<id-semantico>RICHIEDENTE.RESIDENZA.ITALIA.FAX</id-semantico>
		<value>
			<vbg-value if-property="richiedente.comuneResidenza.siglaprovincia" if-operator="NOT_EQUALS" if-value="EE">
				<campo-statico>richiedente.fax</campo-statico>
			</vbg-value>
		</value>
	</cart-mapping>

	<cart-mapping>
		<id-semantico>RICHIEDENTE.RESIDENZA.ESTERO.COMUNE</id-semantico>
		<value>
			<vbg-value if-property="richiedente.comuneResidenza.siglaprovincia" if-operator="EQUALS" if-value="EE">
				<campo-statico>richiedente.comuneResidenza.comune</campo-statico>
			</vbg-value>
		</value>
	</cart-mapping>

	<cart-mapping>
		<id-semantico>RICHIEDENTE.RESIDENZA.ESTERO.PROVINCIA</id-semantico>
		<value>
			<vbg-value if-property="richiedente.comuneResidenza.siglaprovincia" if-operator="EQUALS" if-value="EE">
				<campo-statico>richiedente.comuneResidenza.siglaprovincia</campo-statico>
			</vbg-value>
		</value>
	</cart-mapping>

	<cart-mapping>
		<id-semantico>RICHIEDENTE.RESIDENZA.ESTERO.VIA</id-semantico>
		<value>
			<vbg-value if-property="richiedente.comuneResidenza.siglaprovincia" if-operator="EQUALS" if-value="EE">
				<campo-statico>richiedente.indirizzo</campo-statico>
			</vbg-value>
		</value>
	</cart-mapping>

	<cart-mapping>
		<id-semantico>RICHIEDENTE.RESIDENZA.ESTERO.CAP</id-semantico>
		<value>
			<vbg-value if-property="richiedente.comuneResidenza.siglaprovincia" if-operator="EQUALS" if-value="EE">
				<campo-statico>richiedente.comuneResidenza.cap</campo-statico>
			</vbg-value>
		</value>
		<value-processing>
			<value-replace>
				<replace-match>\D</replace-match>
				<replace-with></replace-with>
			</value-replace>
		</value-processing>
	</cart-mapping>

	<cart-mapping>
		<id-semantico>RICHIEDENTE.RESIDENZA.ESTERO.TELEFONO</id-semantico>
		<value>
			<vbg-value if-property="richiedente.comuneResidenza.siglaprovincia" if-operator="EQUALS" if-value="EE">
				<campo-statico>richiedente.telefono</campo-statico>
			</vbg-value>
		</value>
	</cart-mapping>

	<cart-mapping>
		<id-semantico>RICHIEDENTE.RESIDENZA.ESTERO.FAX</id-semantico>
		<value>
			<vbg-value if-property="richiedente.comuneResidenza.siglaprovincia" if-operator="EQUALS" if-value="EE">
				<campo-statico>richiedente.fax</campo-statico>
			</vbg-value>
		</value>
	</cart-mapping>

	<cart-mapping>
		<id-semantico>IMPRESA.DENOMINAZIONE</id-semantico>
		<value>
			<vbg-value>
				<campo-statico>titolarelegale.nominativo</campo-statico>
			</vbg-value>
		</value>
	</cart-mapping>